,titles,answers
0,"If Germany calls itself Deutschland, why don't we call it that? Same for all other countries, why not pronounce their native names?","It’s called “*exonyms*”.

Germany is a tricky one, because it was the name that the Roman Empire gave to that area. But the very people didn’t call themselves that.

However, remote places kept the reference to the Roman name. And adding that until 250 years ago the fastest way you could travel was on a horse, people stuck with a lot of exonyms, letting them be cemented into language long before we had more direct communication."
1,"Why do all girls seem to find other girls attractive, even though they’re not bi/lesbian?",noticing beauty is different than having sexual attraction
2,Is it reasonable to not want to marry someone who can’t provide?,"Hi /u/throwaway29383p,

We noticed you are a pretty new Reddit account, so we just wanted to let you know to check out the subreddit rules [here](https://www.reddit.com/r/NoStupidQuestions/wiki/rules) and maybe have a read through our [Frequently Asked Questions](https://www.reddit.com/r/NoStupidQuestions/wiki/index/faq) - they make for fascinating reading!

We're called No Stupid Questions because we believe nobody needs to be attacked for asking a question, but *that doesn't mean there are no rules!* This sub is meant for users like you to ask genuine questions. Please don't ask jokes or rants disguised as questions - that's not in the spirit of this sub. While you *can* ask almost anything here, please keep illegal and offensive questions elsewhere to give people a good experience here - and if you have a medical question, please ask your doctor, not us. 
    
Otherwise, welcome!

*I am a bot, and this action was performed automatically. Please [contact the moderators of this subreddit](/message/compose/?to=/r/NoStupidQuestions) if you have any questions or concerns.*"
3,what’s the most offensive thing you’ve ever seen sold and were there any repercussions?,"This isn't super offensive like some suggestions I've seen, but shortly after Star Wars Episode 1 came out is saw some disturbing merch: a JarJar Binks candy sucker. It had a plastic JarJar head and you would push a plunger to make the head split open wide at the mouth and, apparently, suck on the tongue-shaped candy.

6th grade me thought: ""What the *actual* fuck?""

There was indeed some outrage, that item wasn't sold long but it wasn't a newsworthy scandal."
4,If WWIII kicks off would nuclear missiles be shot down over water (given enough time) and/or would nukes be dropped as bombs like WWII?,ICBMs fly into space.  No pilot is going to shoot them down.
5,Explain like I’m 5… how do I shower correctly,"You may need some clinical antiperspirant.  That isn't unusual.

Speak to your Dr."
6,My orthodontist always calls me a good girl is this weird?,"Orthodontist? Is this while getting braces tightened? He may just be used to younger kids moaning bc it hurts 

I am a very hard needle stick, the number of times I've been told 'good girl' and been patted throughout my life after an especially hard time I can't count. 


Sometimes it's someone trying to show empathy or encouragement.

Just speak to him about it. If it continues beyond that,  file a complaint."
7,What exactly am I supposed to be looking at when watching women belly dancing or other forms of erotic dances?,Look at everything at once or any specific thing. Whatever you like. You're supposed to be staring.
8,What happens to the foreskin during sex?,">does the foreskin go in or bunch up at the base

As a man, reading this was very painful.

no, the foreskin retracts to show the glans, but it doesn't go any further, so it remains around the neck of the glans, and yes it does go in."
9,Why is it close to impossible for a new Reddit account to participate on this platform?,Just browse a while. I have a month and have 7oo points. Just installed for a legal  question but there are some interesting subs. By the way is there an index or something with a description of the subreddits? Each day I learn about an interesting sub but I would like to have an index or something.
10,Why the fuck is cling wrap smaller than a a standard dinner plate?,"So you have to use another piece or two to cover it completely, using more wrap making you buy another roll sooner."
11,Is it ok to fantasize about ex gf after a toxic breakup?,I don’t think it’s “not ok” it’s just fantasizing. My ex was posting the same stuff
12,"As a male employee who cleans the women’s restroom, what’s the least awkward way to make sure it’s empty before I enter?","Knock on the door and say ""Cleaning guy coming through! Anyone in there?"""
13,Is it weird to hit on a bartender?,"Just remember that the bartender is at her JOB and is trapped there, while you're on your free time. Give her the option/ability to contact you one day if she's interested, but respect her workspace."
14,How do I remove the poop smell from a bathroom immediately?,Everybody poops. Nobody will think you're a weirdo for pooping.
15,Why do people seem to love to Florida so much?,It's supposed to be hot. Most people go down there to wear sandals and take clothes off.
16,Is it embarrassing to order one meal for two people in a restaurant?,waiters always give me judgmental looks when I order two meals for one person.   but I don't care.
17,Can someone who's practicing Hinduism eat beef if they're starving?,"I’m Hindu. 

Short answer is yes you can eat beef in such a situation. There is a concept we practice called ahimsa which means “non violence”. Ahimsa is where the idea of vegetarianism comes from in our faith. 

However “violence” is allowed in situations of self defense etc. that is the exact moral dilemma Arjun faces in the Bhagavad Geetha. Arjuna was an ancient king who was faced with the moral dilemma of killing his own evil brothers. The Bhagavad Geetha is a conversation between God (Krishna) and king Arjun about this moral dilemma. Basically God tells Arjun he must follow his Dharma and sometimes commit violence to prevent harm to others. 

Eating beef to survive is similar to self defense. 

There’s a good section on non-human life here: https://en.m.wikipedia.org/wiki/Ahimsa"
18,Do you accept that humans are animals (primates)?,"Hi /u/Fuzzy-Chemist3110,

We noticed you are a pretty new Reddit account, so we just wanted to let you know to check out the subreddit rules [here](https://www.reddit.com/r/NoStupidQuestions/wiki/rules) and maybe have a read through our [Frequently Asked Questions](https://www.reddit.com/r/NoStupidQuestions/wiki/index/faq) - they make for fascinating reading!

We're called No Stupid Questions because we believe nobody needs to be attacked for asking a question, but *that doesn't mean there are no rules!* This sub is meant for users like you to ask genuine questions. Please don't ask jokes or rants disguised as questions - that's not in the spirit of this sub. While you *can* ask almost anything here, please keep illegal and offensive questions elsewhere to give people a good experience here - and if you have a medical question, please ask your doctor, not us. 
    
Otherwise, welcome!

*I am a bot, and this action was performed automatically. Please [contact the moderators of this subreddit](/message/compose/?to=/r/NoStupidQuestions) if you have any questions or concerns.*"
19,"How many guys out there make an effort to make a woman cum first? Or just if it happens it happens, it's up to her?",The sex after a woman cums is way better and way wetter
20,Can anyone give me any authentic dating advice beyond 'roids and gym bro'?,"Hi /u/AccomplishedDot6899,

We noticed you are a pretty new Reddit account, so we just wanted to let you know to check out the subreddit rules [here](https://www.reddit.com/r/NoStupidQuestions/wiki/rules) and maybe have a read through our [Frequently Asked Questions](https://www.reddit.com/r/NoStupidQuestions/wiki/index/faq) - they make for fascinating reading!

We're called No Stupid Questions because we believe nobody needs to be attacked for asking a question, but *that doesn't mean there are no rules!* This sub is meant for users like you to ask genuine questions. Please don't ask jokes or rants disguised as questions - that's not in the spirit of this sub. While you *can* ask almost anything here, please keep illegal and offensive questions elsewhere to give people a good experience here - and if you have a medical question, please ask your doctor, not us. 
    
Otherwise, welcome!

*I am a bot, and this action was performed automatically. Please [contact the moderators of this subreddit](/message/compose/?to=/r/NoStupidQuestions) if you have any questions or concerns.*"
21,When did pitbulls become so evil? When I was growing up it was rottweilers that were the most terrifying dog. What happened?,"Past 5 years? They've been banned in the UK since 1991, this isn't a sudden new thing."
22,What is a soy boy?,they are basically calling you a wimp or pussy.
23,How do americans afford uber?,"We don’t use Uber as an everyday thing, just special occasions where you really need it."
24,Why is society designed for only morning people and not night owls?,And as a night owl that’s the way I like it. I love having the night to myself
25,"If Justin Bieber hates the fame so much, why does he keep performing?",He signed contracts. He can't stop now
26,Has anyone else just accepted that retirement is just not a possibility?,I'm pretty sure I will have to work a half day on the day of my funeral.
27,"Why do people put the ""In memory of"" stickers on their cars?",Where I live the stickers are sold to friends and family and the proceeds are used toward the funeral costs because the deceased person is young and the family didn't have any plans in place for burial.
28,Sober People - What do you order at the bar?,Soda water and lime was always my go-to.  I actually like the way it tastes and I find it very thirst quenching.  I never saw anyone roll their eyes or heard any comments about it.
29,How can I get over small penis anxiety,"Some girls care, some don't. Keep putting yourself out there till you find someone who is compatible with you."
30,"If humans and chimpanzees share 99% of their DNA with one another, then why do human siblings share only 50%? What's going on here?","Hi /u/johnnysLeftShoes,

We noticed you are a pretty new Reddit account, so we just wanted to let you know to check out the subreddit rules [here](https://www.reddit.com/r/NoStupidQuestions/wiki/rules) and maybe have a read through our [Frequently Asked Questions](https://www.reddit.com/r/NoStupidQuestions/wiki/index/faq) - they make for fascinating reading!

We're called No Stupid Questions because we believe nobody needs to be attacked for asking a question, but *that doesn't mean there are no rules!* This sub is meant for users like you to ask genuine questions. Please don't ask jokes or rants disguised as questions - that's not in the spirit of this sub. While you *can* ask almost anything here, please keep illegal and offensive questions elsewhere to give people a good experience here - and if you have a medical question, please ask your doctor, not us. 
    
Otherwise, welcome!

*I am a bot, and this action was performed automatically. Please [contact the moderators of this subreddit](/message/compose/?to=/r/NoStupidQuestions) if you have any questions or concerns.*"
31,"Why do people say ""Quote Un-Quote"" and THEN say the thing that is the quote?",It's supposed to be used when you're only quoting one word
32,Why don’t households have water fountains?,What does  a water fountain do that can't be accomplished with a sink?
33,What to when someone owes you money but won’t pay you?,"Let him know that you are really needing that money back ASAP. If it does not happen within the next week, then yes I would cut him off, especially if you already had reasons to do it anyway. Money should not make or break friendships but with all my friends they have paid me back exactly when they told me they would after borrowing money, so I personally have not had this problem before."
34,how can i kindly say i don't wanna have sex with someone after we already took off some/all of our clothes?,"It's impossible to clearly communicate this boundary without hurting their feelings. Just be honest and deal with the fallout. 

To avoid this, I personally try not to have sex the very first time we see each other naked, more work your way up to that with a ""second base"" date so you can see what you're working with before getting to that point"
35,"How did the song ""Makeba"" by Jain become Instafamous suddenly?","""Makeba"" by Jain is surging in popularity thanks to a TikTok trend featuring Bill Hader. 

https://www.insider.com/how-miriam-makeba-inspired-viral-tiktok-meme-dance-2023-7

The same way the 80s song Running Up That Hill by Kate Bush was shot back to the top of the charts after it was used in one scene of Stranger Things."
36,Is everyone getting spammed with dm's from onlyfans chicks?,Yep. Not every day though
37,Are there ways a man can masturbate to completion without stroking his dick?,Massage your prostate.
38,Why do girls comment on other girls’ posts so much?,">guys don’t seem to validate each other

Ever notice all the lonely men with no close human connections?"
39,going long periods of time without verbally taking. Have you ever done that? for how long? is it a bad thing?,"Are you having trouble with other things like sleeping/bathing/eating? In other words, are you depressed? Self-isolation is a very common symptom of clinical depression. What’s the rest of your life like?"
40,Why does Reddit have so many troll posts even though this site is anonymous?,"two reasons come to mind. one, it's entertainment, for the reader or the writer. two, the writer has an agenda they want to push, and the story (in theory) advances that agenda in people's mind if it is believed. the ""down with cis bus"" story comes to mind although that's not from this site."
41,Why do people on the internet say that people with large age gaps “have nothing in common?”,"Yeah I think you're misinterpreting it. It's not about having common interests, it's about the stage of life you're in. You can be friends at pretty much any age, especially adults. Relationships though, building a life with someone requires you to be on the same ground mentally. A 28 year old is in a significantly different place in their life than an 18 year old, but a 45 year old is more likely to be in a similar place as a 55 year old."
42,Am I crazy or do I have zero self respect?,"No. You're just human and you made some mistakes. More than that, you're dealing with an emotional abuser, they twist and distort things and I have no doubt that he did that to you as well.

It's not your fault, at the end of the day, he did what he did. He knew it, and did it anyway. 

 You should however, consider getting help both for your addictions and your mental health. People like him love to exploit people that have vulnerabilities. That's the sort of people abusers target, because they love to control."
43,Is it weird that I don't like and don't identify with my culture?,I’m more a citizen of the internet than my country. I don’t think it’s weird I think it’s just your lifestyle
44,What do people mean by you're born alone and you die alone?,"I always understood it in a slightly less literal sense. You might be surrounded by people, friends, family, you may belong to a close community, but ultimately there is a limit, to which one can know and understand the other. In that sense each individual is alone in the entirety of their being and their experiences. You are born alone as an individual and you die alone as an individual."
45,is Gen z screwed?,"You shouldn’t want to buy a house at 18. That’s insanity. Stick with the parents or get some roommates and learn how that chaos works. 

I’m going to assume you’re American (as am I) and you’re conditioned to achieve all these things that define you’re success. They’re bullshit. The American dream isn’t real. It’s a way to force you into a life of consumerism and be the good little cow they can milk for money while you eat out of your feed bag. 

Stay at home if home life isn’t bad. Get through college or technical school. Save up money at a minimum.

Do you know how many Europeans stay living at home until they’re almost 30? Even in super serious relationships. They save up a ton of cash and then move out when they can put a huge sum down on a house or apartment and finally break off to start their lives together."
46,Do chocolates made by a professional confectioner differ from mass produced ones like Snickers?,"Yes, they taste better"
47,Is it possible for an extrovert to become an introvert?,Social anxiety perhaps? I was a huge extrovert up til about high school when I got randomly bombarded with anxiety and became more & more of an introvert. Maybe going into elementary was scary for kid you
48,Do you see yourself getting old?,"I'm 53.

I have been seeing myself ""get old"" since 27."
49,Are you actually inconvenienced by the actor/writer strike?,Forgot about it 5 minutes after it started.
50,Why do some people like eating ass?,Because it makes their/our partner feel good.
51,Why is men’s fashion so boring?,"It's not, it's just associated with homosexuality. What you understand to be men's fashion is just a bunch of dudes terrified of being called gay."
52,Is it true on OnlyFans when I message a girl it’s mostly a dude that manages multiple women’s accounts?,"I know a few content girls with managers, however the managers don't answer the inbox messages. But, I also know a few girls who have their boyfriends respond to the inbox messages. Most of them answer their own messages."
53,"Why is the URL for ""X"" still twitter.com and not x.com or something like that?",A rebranding like that takes a lot of planning and effort.
54,Why are you religious?,"I was born Orthodox Christian, became atheist, and then returned to Christianity when I had a moment of ""feeling"" faith for the first time in recogniseable way.

These days I live very much in religous way, and it benefits my life and people around me."
55,"Clowns are supposed to be funny, since when clowns became creepy and scary ?","Always? The clown look hasn't changed that much over the years, and I'm just as creeped out by pictures of old clowns as I am of pictures of modern clowns."
56,"If someone wants to fall asleep and they close their eyes, why can’t they fall asleep?",Their mind is running. They're restless. They don't feel good. Theyre stressed.
57,who was the person first decided that boys color is blue and girls is pink?,"Athanase Garnier, 1823 

https://en.wikipedia.org/wiki/List_of_historical_sources_for_pink_and_blue_as_gender_signifiers"
58,Why do scammers love Whatsapp?,"WhatsApp has about 2.7 Billion active users. 

SnapChat has  750 Million. 

Facebook Messenger has about 150 Million. 

If you wanted to run a scam where only 0.01% of the messages result in a successful scam, which platform would you pick?"
59,Does anyone else get a random horrific thought and have to physically shake their body to stop thinking about it?,"Sure, for me thought OCD + tic/tourette kind of thing

Professional help would probably help with that"
60,Why is a marriage proposal usually a surprise and not a discussion?,"It's not, or at least it shouldn't be.  The *timing* of a proposal can be a surprise, but the actual proposal itself should be the culmination of the relationship and shouldn't be a surprise."
61,Is it possible to have asthma without ever having an asthma attack?,Yes. Asthma bronchiale is a chronic inflammation of the airways of the lungs. Mild forms can go for years or indeed indefinitely without an attack. But rarely without any symptoms at all.
62,How often do you think about sex?,Daily.
63,Is there a left handed way to fold sheets?,"Same family situation. Mom was a lefty, I'm almost ambidextrous due to switching hands so often. Are you talking about fitted sheets? Because I cant imagine that a flat, square, top sheet would be no different no matter how its folded.

Edit: you should have told your girlfriend to flip it over and turn it around and then it would be the right way."
64,Did the US military establish no fly zones prior to 9/11?,"Yes. I used to fly to Vegas as a kid from Calgary, and it was a longer flight than it should have been because there was some sort of air base in the middle that the commercial planes couldn’t fly over"
65,"What to expect when dating a 66 year old, beautiful woman?","Unless you can find a redditor who has dated this specific woman, you're not going to get any useful answers here.

You're dating an individual, not an age group. You behave the way you would behave on any date."
66,Why is the British Empire demonized but the Roman Empire (among others) romanticized?,Of course we gotta romanticize the Romans. I mean the word romantic literally comes from them
67,Can you get a DUI if you're mowing your grass drunk?,"Where I am, the rule is if the device has internal motive effort. I.e., if it is a self-propelled or riding mower, you can get a DUI. However, you wouldn't for a purely mechanical push-mower. That being said, I'm sure the rules differ by location.

That being said, never operate machinery while intoxicated. You might not lose your freedom, but you could still lose your foot."
68,How much time should pass between asking someone out and the date itself?,"It should be sometime within a week. Probably on Friday or the weekend, but if it's something more casual you might go out after work or school."
69,How much cocaine do you think Ric Flair did in his prime wwe career?,ALL of it
70,Who ruined vampire lore?,"Bram Stoker's *Dracula* has its own strong sexual themes, but it is more restrained about expressing them. That was the norm for the era it was published in (1897 Victorian England)."
71,Why is (pig)-let only used for some words?,There is very little in the English language that is consistent and makes sense in all cases
72,Why do you hardly see the spouses of celebrities take their last names?,"Celebrities' names are their brand.  Changing it affects their brand. It happens, but not frequently.  Courtney Cox added ""Arquette""."
73,"When you were younger, what were some expectations you had about adulthood that ultimately went unfulfilled?",Being able to become anything I wanted
74,Anyone else struggle with personality tests?,Stop trying to think and just answer in 2 seconds.   You don't get to determine the outcome in life by gaming the challenges.
75,Why is it considered bad practice to make tea in the microwave?,It doesn't.  Some people just like doing things a certain way.
76,Would you install a tracking app (location) on your phone if your partner wants to check on you? Would you want to want to track them?,No and no.
77,Why do you need to be 21 in America to buy an alcohol drink but no other products containing alcohol,"Most things like that will get you sick before they get you drunk.

If you try to drink enough mouthwash to get drunk as a normal person you're going to have a very bad time."
78,What is the reasoning behind the removal of awards on Reddit?,"They didn't think it carried its weight, and the added visual and cognitive clutter didn't weigh up against the fun and income it brought."
79,What can I do to shower and brush teeth more frequently?,"Do it at the same time every day and tie it in with things that you enjoy. For example, only listen to a podcast or certain music that you like when doing this activities. You can also download apps for tracking daily activities. I really fun one that uses a video game model is Habitica. Everytime you complete a habit or goal you get experience points to help you fight monsters."
80,A guy who was in the same class as me when we were in elementary school (the first 5 years of school here) just messaged me and asked if I wanted to join a group chat with him and some people from back then. How do I politely tell him no?,Don't respond at all.
81,Why are diehard sports fans so irrational towards opposing fans and players?,Trust me when I say sports fans hate one certain player in their team more than anything else. More than opposition as well.
82,How much water would a citizen have to hoard for it to impact the local ecosystem enough to be noticed?,"Hi /u/AstroPop2023,

We noticed you are a pretty new Reddit account, so we just wanted to let you know to check out the subreddit rules [here](https://www.reddit.com/r/NoStupidQuestions/wiki/rules) and maybe have a read through our [Frequently Asked Questions](https://www.reddit.com/r/NoStupidQuestions/wiki/index/faq) - they make for fascinating reading!

We're called No Stupid Questions because we believe nobody needs to be attacked for asking a question, but *that doesn't mean there are no rules!* This sub is meant for users like you to ask genuine questions. Please don't ask jokes or rants disguised as questions - that's not in the spirit of this sub. While you *can* ask almost anything here, please keep illegal and offensive questions elsewhere to give people a good experience here - and if you have a medical question, please ask your doctor, not us. 
    
Otherwise, welcome!

*I am a bot, and this action was performed automatically. Please [contact the moderators of this subreddit](/message/compose/?to=/r/NoStupidQuestions) if you have any questions or concerns.*"
83,What do people think about when they are buying expensive designer things?,"A lot of cynical, non serious answers here so far. 

""This is better quality.""

""This will look perfect with my [item] at that [event].""

""Self care."" (Lol i know it's goofy but retail therapy is a thing)."
