,titles,answers
452,Helped my sister backup her phone to my computer...,"Hi /u/EconomistPersonal910,

We noticed you are a pretty new Reddit account, so we just wanted to let you know to check out the subreddit rules [here](https://www.reddit.com/r/NoStupidQuestions/wiki/rules) and maybe have a read through our [Frequently Asked Questions](https://www.reddit.com/r/NoStupidQuestions/wiki/index/faq) - they make for fascinating reading!

We're called No Stupid Questions because we believe nobody needs to be attacked for asking a question, but *that doesn't mean there are no rules!* This sub is meant for users like you to ask genuine questions. Please don't ask jokes or rants disguised as questions - that's not in the spirit of this sub. While you *can* ask almost anything here, please keep illegal and offensive questions elsewhere to give people a good experience here - and if you have a medical question, please ask your doctor, not us. 
    
Otherwise, welcome!

*I am a bot, and this action was performed automatically. Please [contact the moderators of this subreddit](/message/compose/?to=/r/NoStupidQuestions) if you have any questions or concerns.*"
453,Why do commercials advertise prescription medication?,"People may have chronic conditions, and the drug they've been taking for years kind of sucks.   But that's all there is, so they just get it refilled every 6-12 months.     Now, there's something new for that condition, so maybe it's worth asking about a change.   

People might have chronic conditions, and there was no drug - or the drug available just didn't work.  Now there's a new drug, so it's worth a doctor visit to ask about the new drug.   

People might not like going to doctors.  They have chronic conditions that they just deal with, because their parents and others they spoke to told them there was nothing to do.    Seeing a commercial might wake them up to the fact they might get treatment - so instead of just dealing, they visit a doctor and ask. 

These kinds of ads only happen in New Zealand and the US today."
454,Does anyone feel like eating is a chore? How do you change this mentality?,"me! i do!

it’s just always SO inconvenient!"
455,Did anyone ever take the fall for faking the evidence that caused USA and UK to invade Iraq?,Millions of Iraqis did
456,I made some bad cookies that are still edible. What’s another name I can call them that will lower expectations?,Hurl scout cookies
457,Commuting 62 Miles,"That is a lot of mileage on a vehicle.  That is a HUGE expense for gas and proper vehicle maintenance.    If you correctly report this commute to your auto insurance company, your auto insurance rates will likely go up also.  (most insurance companies want to know how far you drive to work - it is part of the calculation for your insurance.)  It isn't really making more money if that money is going into your gas tank instead of your wallet.

If this salary is based on a 40 hour work week and you are also driving 2 hours per day - then you actually have a 50 hour work week.  You can't really do much to make up for the time spent driving.  (maybe use the time for digital books - otherwise, it is just lost time that was lost because of your job)  Your time is valuable and giving up too much of just to get to and from work is a waste.

If you have no job - then take it.  Anything is better than nothing most of the time.  If you currently have a job, then take a very good look at how much it might cost you to drive so far vs what you spend to get to and from work right now.  Are you really gaining something from changing jobs?  Of course, if you hate your current situation or if this company is your ""dream job"", then the move may be worth it at any cost.  

I am just trying to tell you that sometimes the numbers sound good and look good on paper until you realize how much other things it is costing you for this change.

There is also the consideration of moving closer to the job to reduce the commute if possible.  Work it for a while to make sure you are going to stay there and then move closer."
458,I thought uploading videos to YouTube didn't use up data?,"When you upload something to YouTube, it still needs to download that file to put on there severs."
459,Why do people (especially army) eat crayons?,They're making fun of the army people for being stupid by saying they eat crayons. Like if you were in school you might accuse a fellow student of being a paste eater.
460,"If Napoleon somehow died (assissnation) at the height of the Napoleonic War, who would replace him? His 2nd in command?","This is tricky because there was no real established successor line aside from the general rules of Empirical inherency. There was never a peaceful change of power in the First French Empire, so there was no tradition or custom to follow. 

Depending on when Napoleon died, his son could have taken over. IIRC, when Napoleon abdicated finally in 1815, he named his son as the new Emperor. This is the expect line of succession for an Emperor. Of course, his son was just a boy, so regent would likely be assigned (who that regent would be, it's hard to say).

If Napoleon died before having his son, I could see Joseph Bonaparte (Napoleon's older brother) taking over, or at least having the strongest ""legitimate"" claim.

However, it would unlikely be this simple. There would no doubt be a power struggle between his marshals, his family, and there would likely be a monarchist surge at the time as well."
461,What’s a nice way to ask someone if they don’t want to talk to me when I’m initiating all the conversations,"Try just setting new expectations, if you generally initiate, then theyre expecting you to continue to do so, and thats not necessarily a bad thing. Tell them to that youre a little busy and to hit you up when they have the time. That way, youre subtly telling them to initiate, but youre also testing if they really like you. If they never hit you up, then cut your losses and move on

Hope this helps!"
462,How do the phone companies know who to call when you dial 911?,"> Is it based on where you are?

Yes.

>  What if your GPS isn't working? 

It doesn't use your GPS, since only your phone knows its own GPS coordinates. Your phone is connected to a nearby cellphone tower, so your location for the emergency services is based around the location of the tower.

>  If I visit say China and call 911 who is gonna get my call its not gonna be the local authorities, so what station would get the call and why?

Nobody will get the call, because 911 is an invalid number in China. Countries have different emergency numbers. For example in Europe the number is 112 (however some countries will have 911 or 112 direct to their emergency number)."
463,is he flirting with me or just being nice?,"Not enough info, but off of that you gave I would say probably"
464,Do most people watch reviews just to have their own opinion reaffirmed rather than to hear different opinions in general?,Yes 🤍
465,Should I try to get a refund if I paid for a product that I didn't receive when it's not the business' fault?,"Hi /u/Illustrious_Hat2052,

We noticed you are a pretty new Reddit account, so we just wanted to let you know to check out the subreddit rules [here](https://www.reddit.com/r/NoStupidQuestions/wiki/rules) and maybe have a read through our [Frequently Asked Questions](https://www.reddit.com/r/NoStupidQuestions/wiki/index/faq) - they make for fascinating reading!

We're called No Stupid Questions because we believe nobody needs to be attacked for asking a question, but *that doesn't mean there are no rules!* This sub is meant for users like you to ask genuine questions. Please don't ask jokes or rants disguised as questions - that's not in the spirit of this sub. While you *can* ask almost anything here, please keep illegal and offensive questions elsewhere to give people a good experience here - and if you have a medical question, please ask your doctor, not us. 
    
Otherwise, welcome!

*I am a bot, and this action was performed automatically. Please [contact the moderators of this subreddit](/message/compose/?to=/r/NoStupidQuestions) if you have any questions or concerns.*"
466,Would it be harder to go without salt or sugar for the rest of your life?,Salt
467,"In The Martian movie, when the potatoes die, why cant he grow more?","He had no space to grow more. The area where he was able to grow them, after he put in a lot of work to make that possible, was damaged beyond repair with the limited tools and supplies he had."
468,Do all people have a sort of “lazy eye”?,Nobody is completely symmetrical.
469,Why do organisations and countries often not want to accept minority languages as official languages?,"Official language have other ramification, like the right to go to court in that language and stuff like that. Some belgian civil-servant told me that they loose a lot of time with getting every federal document bilingual and making sure that both version of the text say the same things

France is a very centralized country, and one of the first document which built modern France is that XVth century law saying that laws, courts and contracts have to use *Paris French* and no local dialect. Add  Napoleon and the Third republic, and every regional language was killed."
470,who do people not like their family seeing them workout?,"I hate anyone watching me workout. Family is the worst because they don't know what the fuck they're talking about, but they have no issues telling me that whatever I'm doing is wrong. 

I finally had to tell my wife that when I'm in the garage exercising, she is not to come interrupt me under any circumstance or else I was going to add a second deadbolt to the door that locks from the garage side"
471,Why do fan speeds go from 1-2-3-0 instead of 0-1-2-3?,"Because it takes more effort to start the fan to keep it spinning, so the put the highest speed right after to make sure it can get going."
472,Why do football coaches (NCAA/NFL) need personal security,"I am not a sportsball watcher, but I have seen many videos of people getting onto the field in spite of regular security and I've heard of fans who have feelings for coaches that are both very negative and very passionate, so I figure the extra security is prudent."
473,"Women of reddit, is having a gay best friend as a straight male a turnoff? If so, why?","Yes, it matters.  Because if your gf has an adverse reaction to him, then you know she's worthless.

Iy would not matter to me at all if my bf's BFF was gay."
474,What and why's it creepy going to a club alone as a man?,"Nothing creepy about that. You spend your time however you want and with whomever you want. As long as you're not hurting anyone by doing it, it's nobody else's business."
475,Why is there pretty much no representation of Middle East/Middle Eastern people in video games?,"There are a few. Assassin’s Creed, Prince of Persia, the recent Total War: Pharaoh, and many other games set in Egypt.

But yes it’s way less than games set in Japan and “Fantasy Europe”."
476,Why am I so viscerally afraid of spiders?,I feel the same way. Only baby jumping spiders I find cute and not afraid to touch.
477,Why do I sometimes feel a static pulsating feeling in my head and back?,"Hi /u/Hive_of_ants,

We noticed you are a pretty new Reddit account, so we just wanted to let you know to check out the subreddit rules [here](https://www.reddit.com/r/NoStupidQuestions/wiki/rules) and maybe have a read through our [Frequently Asked Questions](https://www.reddit.com/r/NoStupidQuestions/wiki/index/faq) - they make for fascinating reading!

We're called No Stupid Questions because we believe nobody needs to be attacked for asking a question, but *that doesn't mean there are no rules!* This sub is meant for users like you to ask genuine questions. Please don't ask jokes or rants disguised as questions - that's not in the spirit of this sub. While you *can* ask almost anything here, please keep illegal and offensive questions elsewhere to give people a good experience here - and if you have a medical question, please ask your doctor, not us. 
    
Otherwise, welcome!

*I am a bot, and this action was performed automatically. Please [contact the moderators of this subreddit](/message/compose/?to=/r/NoStupidQuestions) if you have any questions or concerns.*"
478,It’s reported that sperm whale can create sounds up to 233 decibels. It takes at least 185 decibels to kill a person. Can sperm whales really kill us via Fus Ro Dah shout?,"Pretty much, yeah. It's not really a fus ro dah, but hey."
479,Fun things I can do outside by my self?,"Give back to your community through volunteer work. Look into Rotary, as an example."
480,Can someone comfort me for a minute?,"Unfortunately, sometimes in life we can hurt people without meaning to. I think she probably knows you didn’t mean to hurt her, but you did, and if she keeps talking to you it will bring back those bad memories again. 

You did nothing wrong, and hopefully at some point you and she will reach a stage where you are able to talk again. 

Until then,
 
*HUGS*"
481,How do I nicely tell a guy to chill out a little bit? lol,"every time he says something sexual: 

stare at him

don't say anything"
482,What does “based” mean,"Finally, someone asks the real questions!"
483,How do I know what is and isn't a good car?,"Consumer Reports has one of the better auto buying guides.  They compile a lot of data on cost to own, reliability, etc.  They even have lists of suggested used cars in various price ranges.  It would be worth the small subscription cost to access it."
484,Is it normal to mull over a car decision for multiple months?,Just get an old benzo its big enough and tough enough and fast enough geeez
485,Pavegen and Transparent glass solar panels ?,"If you want a photon to produce energy you have to absorb it. Any transparent solar pannel can only ever be some kind of dark glass that absorbs bits and lets throuh other light. That means it does not do the job of a window nor is it a good power source. And it costs like 20 times the price of glass.

The same is true for paving roads, its minimla enercy gains for incredible waste of resources.

Rock on the floor is cheap, highly processed metals, plastics and more on the road is expensive and polluting the environment."
486,Can I make frozen yogurt just by freezing yogurt?,You need to stir it as it freezes. It’s most easily done with an ice cream maker
487,Can hickeys be dangerous?,"There have been cases where they have caused clots which have then resulted in strokes, some fatal.  They are though really fucking rare."
488,Why should I care so much about the opinions of family ?,"its your life, live it how you want then"
489,can i put a clothes drying rack on carpet?,"It shouldn't be a problem. Hang longer items (like pants) towards the top so they don't touch the carpet. Try to have the drying rack as close to a heating source as possible, without it being a fire risk.

You could also place a towel down underneath the drying rack to absorb any drips if you're worried, or place the drying rack in the bathtub (if that's convenient for you)."
490,Just saw a homeless man with a phone,"Hi /u/Fabulous_Air8956,

We noticed you are a pretty new Reddit account, so we just wanted to let you know to check out the subreddit rules [here](https://www.reddit.com/r/NoStupidQuestions/wiki/rules) and maybe have a read through our [Frequently Asked Questions](https://www.reddit.com/r/NoStupidQuestions/wiki/index/faq) - they make for fascinating reading!

We're called No Stupid Questions because we believe nobody needs to be attacked for asking a question, but *that doesn't mean there are no rules!* This sub is meant for users like you to ask genuine questions. Please don't ask jokes or rants disguised as questions - that's not in the spirit of this sub. While you *can* ask almost anything here, please keep illegal and offensive questions elsewhere to give people a good experience here - and if you have a medical question, please ask your doctor, not us. 
    
Otherwise, welcome!

*I am a bot, and this action was performed automatically. Please [contact the moderators of this subreddit](/message/compose/?to=/r/NoStupidQuestions) if you have any questions or concerns.*"
491,Do other people define us?,"You define who you are to yourself.  
I decide what you are to me."
492,Why do men get fired and/or written up at jobs for being emotional and/or loud but women don't?,Your personal experience likely doesn’t accurately represent reality. That’s just my take.
493,Has men having to aim to pee vs women who do not have to aim shaped civilization?,"I think you have it backwards. It's the fact that women can't pee standing up that's driven civilization. If women, like men, could easily pee standing up, public urination would have remained a universal thing. Urinating on the side of the road, into a sewer grate, etc would have been the norm. We only would have developed toilets for shitting"
494,"Is yanking a car wheel, making the car swerve back and forth on the highway, considered abuse?","It sounds like it could be psychological abuse, yes.

In any case, abuse or not, he put both your lives in serious danger: that kind of behaviour can cause fatal accidents. I don't know if he was being deliberately abusive, or is suffering from some kind of psychological disorder that could be treated with therapy or medication. Either way, you probably shouldn't be spending your life with a man who might get you killed."
495,"How do Reddit collectible avatars work, and are they an investment?","Robux is currency. Avatars are NFTs. NFTs are scams.

You can spend $25,000 on the most ""unique"" avatar ever but you'd never see any returns because no one would ever want to buy your avatar because it's an NFT and NFTs are scams."
496,Hey have y'all ever do a lock in before?,Your adult friends want to do this too? I'm not knocking the idea I just wouldn't have done that at 21.
497,How do you get over betrayal?,"Damn that first sentence is a good way to put it. It just takes time, giving less thought and energy to the situation will become easier."
498,"What is that ""Fwoosh!"" Sound you hear when things spontaneously combust?","If you're watching a movie or TV show, what you're hearing is a sound effect added in post-production to heighten the drama."
499,Why do backpacks seem more common with adults while out in public now?,The briefcase was determined to be 100% stupid and impractical.
500,Will having gone to a fancy high school haunt me in my adulthood?,No 😂
501,What is the best way to spend time with a dog that doesn’t have much time left?,"Spoil him rotten! I did this with my girl before she passed a few years back. Buy all of his favourite treats, take him for rides in your car, play with his favourite toys, sleep with him, etc.

:)"
502,"Do souls age when they lose their bodies early on?(ie:child murder,premature death,etc)",That would imply an afterlife with the same consciousness and personality that was formulated here. Thats fairytale stuff.
503,Is it very normal in US to video record someone doing any random activity ?,"Not really. If you're watching videos that are viral or trying to be viral, those are probably staged."
504,Why our body want to scratch a mosquito button while it only get worse when we do it ?,"Because it's itchy. Our body only tells us when we are itchy, it is up to the brain to act on the impulse"
505,Is there a term to describe both and only Canadians and Americans?,Former British colonies of North America.
506,How safe is it to eat honey from a random beehive in the wild?,"Your question is unanswerable because you put the word ""random"" in there. 

A beehive deep in the Monongahela wilderness? Probably okay. Enjoy.

A beehive in the forests near the Chernobyl nuclear meltdown site? Or downstream from an industrial farm? I'd think twice."
507,"Those of you who spend 10 minutes checking out when you finally get to the cash-register, what's taking so long?",Are you talking about self-checkout?
508,College football,Everything about Colorado is about ratings. Deion brings eyeballs. The man has all of us staying up to watch two bad programs like it’s a Super Bowl. They’re going to milk this shit for everything it’s worth.
509,Do you think it's bad to desire power and prestige for its own sake?,"Hi /u/HouseElf245,

We noticed you are a pretty new Reddit account, so we just wanted to let you know to check out the subreddit rules [here](https://www.reddit.com/r/NoStupidQuestions/wiki/rules) and maybe have a read through our [Frequently Asked Questions](https://www.reddit.com/r/NoStupidQuestions/wiki/index/faq) - they make for fascinating reading!

We're called No Stupid Questions because we believe nobody needs to be attacked for asking a question, but *that doesn't mean there are no rules!* This sub is meant for users like you to ask genuine questions. Please don't ask jokes or rants disguised as questions - that's not in the spirit of this sub. While you *can* ask almost anything here, please keep illegal and offensive questions elsewhere to give people a good experience here - and if you have a medical question, please ask your doctor, not us. 
    
Otherwise, welcome!

*I am a bot, and this action was performed automatically. Please [contact the moderators of this subreddit](/message/compose/?to=/r/NoStupidQuestions) if you have any questions or concerns.*"
510,My Female Co worker got me in serious trouble!,If this isn’t a bait story. Record it somehow. Gather evidence and protect yourself.
511,Looking for a new vet?,You call up the vet and ask if they are taking new patients.  Then make an appointment for a checkup.
512,Do people actually think the president controls everything?,"I `__USE__` to think that until I saw how just about everything Trump tried to do was _""blocked by a federal judge in whatever state""_ then I realized that it doesn't actually matter that much who the president is. The entire system is very resistant to change from the top-down. It really has to come from the bottom-up. The public have to really want it."
513,"Weird wet spot randomly appeared on bed, what caused it?","Drool, sweat, insert whatever here. The spot doesn't necessarily appear suddenly, it can take some time for body oils to oxidize, or maybe you just didn't notice it sooner."
514,Is 88% battery after 15 months good for an iPhone 12?,[deleted]
515,"Owners of dog-aggressive dogs, why do you bring them to public places with other dogs?","I had a very ill-tempered Jack Russell Terrier (Terror). He was not a very stranger friendly dog, despite having puppy obedience training and proper socialization. He was just a one-person dog and that person was me. He never left my house without me having a tight hold on his leash, I wasn’t about to get sued because someone’s kid tried to pet my dog and got bit. He didn’t like other dogs either, he was an equal opportunity hater. He crossed the rainbow bridge in April at 15 years old and I sure miss the little monster."
516,How much can the human body regenerate?,"It depends on the tissue lost.

If all you lose is some skin, it can come back. But if you lose  tissue that doesn't regenerate then it won't come back. Heart and brain cells don't regenerate. You have all the heart and brain cells you'll ever have."
517,Do you turn on subtitles/cc's when watching movies/TVs?,Yes always
518,Is it weird to want to tour a foreign country again rather than a new country?,No. There’s too much of Japan to condense in a single trip. It’s an amazing country. And sometimes you just fall in love with a place. Go where you’re happiest.
519,Does anyone else feel like they can’t get a date and like they’re way uglier than their parents?,No.
520,"If you are found not guilty of a crime, then later confess to doing the crime, can you still get in trouble?","""Confessing"" something on a TV show or camera isn't a legal confession."
521,Has technology progress slowed down?,vR Muh dude. Also self driving cars.
522,EX resubscribed to my Disney+ du subscription. Is there anything I can do about it?,Cancel the credit card and report it as a fraudulent charge.
523,"Why do things become less funny (for certain people) once they find out they're fake or scripted, yet TV shows and movies can still be funny?","As a pro wrestling fan, I've wondered this for years. Movies, TV shows, novels, songs, paintings, etc. are all created for other people to enjoy, but pro wrestling is the only one that is ""fake"" and therefore bad."
524,does red lobster actually use the lobsters in the tank,"Yes, you can ask for a specific one to be cooked up for your meal."
525,What the hell is so bad about free insulin?,"Pretty much nothing, other than reduced profits."
526,Should I still apply to stuff that I feel massively under-qualified for?,"No.  

You acknowledge it is your fault that you're severely lacking to be a qualified applicant yet you want to take that from someone who is?"
527,Does this type of building have a name?,Supermarket?
528,is it fucked up to spray paint a spider purple,yes
529,Boiling water and vinegar in a small pot = reaction??,It's called the jumoes reaction. It's totally rad.
530,"If animals could talk, which one would be the best comedian ?",Clown fish
531,"Before there was internet and cell phones, how did EVERY SCHOOL KID in the country learn the same rhymes and songs, like ""bo bo see atten tatten"" (or whatever it is), or ""joy to the world, the teacher's dead,"" or ""jingle bells, batman smells?""","Same way they still do. Word of mouth. Someone says something, it gets repeated and repeated till it's everywhere.

Something going viral happened long before the internet."
