,titles,answers
232,What maps were used during WW2 in American schools etc.?,"During WW2, Crimea was Russian (though at times occupied by Germany), so the maps would reflect that. The USSR moved Crimea to Ukraine in the 50s"
233,"If I pay the fee, would the car be mine again?","I'll have to contact the towing company and DMV on Monday. 

But even if theoretically I could get the towing company to give me the car, and get the DMV to give me a duplicate title, I would not do it. Because karma is a bitch! 

Luckily, I still have all the paperwork from the sale, so I can show that I sold the car and won't have to pay the towing fees."
234,Why is tattooing a word/name above the eyebrow seen as an entry level face tattoo by those with them?,"It's a current fad that will pass. People will look back at the ""name/word above the eyebrow"" fad like they currently do on fratboy tribals and tramp stamps. Which is why it's never a good idea to participate in ""current fad"" tattoo trends."
235,Can I get a dog for 1 month? How does fostering a dog work?,"You... I mean, if you legitimately want to foster a dog, talk to local foster organisations. They usually need more people to help. If they think you're a good candidate, they will train you and provide food etc.

With that said, the way you phrased this is probably not something that sounds appropriate."
236,Why do store alarm still went on even though all item are already paid?,Whoever was checking you out probably didn't deactivate the security tag properly.
237,Are Americans really stupid when it comes to Geography,"Americans aren’t a monolith.  There are plenty of Americans that know all there is to know about geography, and plenty that know nothing about geography.  Most are somewhere in the middle"
238,Had anything ever had a sharper rise and fall than sea shanties during that one week of COVID?,Tiger King
239,Am I being scammed,"I have never sold medical equipment and cannot confirm that it is a scam, but I wouldn't give a complete stranger a photo of my license. Why not offer just a headshot for identification? My radar has gone off for this, and I have very good intuition!"
240,"When do you, as a male, lose the ability to “shoot”","So far, the answer isn’t 44"
241,"Women, is it a red flag if a man has a condom with him when he goes on a date?","Nah, I think it’s actually really smart. So many dudes would go out just looking to hookup and then get to say “I don’t have a condom” half way through. I think it’s considerate and pretty normal for your 20s"
242,Do certain breeds of dogs have retractable claws?,Took about 1 second to find this on the google https://labradoodlehome.com/do-dogs-have-retractable-claws/
243,Anyone know of a good female hair growth supplement? Should I take a natural shot blocker with biotin and zinc ect and or pre-natal vitamin or both?,"You should see a dermatologist. There are multiple causes of hair loss and even though you suspect it's stress, there could be something medical going on like a vitamin deficiency or hormone imbalance. The doctor would determine the cause and give appropriate treatment specific to your loss."
244,Have anyone noticed how some subreddits seems to shadow hide posts and messages w/o ever noticing the poster?,Silent censorship. Funnily enough something most of Reddit seems to be against.
245,How do I stretch my tongue to make it longer?,"*clears throat*

On behalf of everyone here: Why do you want to make your tongue longer?"
246,Why does my face look incredibly asymmetrical when I use my front facing camera?,"Photographs show your face as others see it, not flipped as you're used to seeing it in the mirror.  Some front facing cameras do reverse,  writing on t-shirts being reversed in some selfies is a giveaway sign of this.  Yours sounds like its showing it as others would see it.

The asymmetry is the same (and normal, most faces are not perfectly symmetrical).  You're just used to the asymmetry being a certain way around and seeing it the other way around makes it obvious.

Edit: A camera you're holding yourself is also likely to be closer than you'd stand to a mirror.  The perspective of a close view can also be unflattering (portrait photographers tend to use a longer lens and stand further away for this reason).  That might also be contributing to you noticing things more."
247,How do I stop sleepwalking and eating?,A locked or blocked door will probably do the trick
248,Would it be weird for me (M28) to see an Olivia Rodrigo concert by myself?,No. I went to the Taylor Swift concert recently and the people next to me were solo too. Normal. Enjoy yourself!
249,Reptilians? Trying to learn.,"https://en.wikipedia.org/wiki/Reptilian_conspiracy_theory might help, or it may just mean us old people are wrinkly"
250,Is it normal to just have 3-4 friends?,"Yes, yes it's totally normal"
251,how to date someone/be seen as a romantic option with women,Seems like you need to start flirting and/or open up about deeper subjects.
252,How did people develop different accents in other countries?,Same way you developed your accent.
253,How do I make effective notes?,"Predict/ anticipate what sort of questions will come up regarding the materials. Ask: How will they test me on this stuff?

Essays/ long answers: reduce materials to # of reasons/ factors for X.

Rote memorization: flashcards. The Anki program/ app is great for this. Creating the cards themselves is a form of studying."
254,"Every couple years they find Levi denim in abandoned mines, and they sell for crazy amounts of money. Are they pulling these off 140yr old bodies? Or did guys just decide to Donald Duck it one day after digging?","Jeans used to be overwear, in fact they used to be marketed as “waist-high over-alls.” You wore them over your nicer pants. It’s not that odd to leave clothing meant solely for protection or covering your clothes, like an apron or a smock, at work."
255,What is a film and TV unit police officer?,"Hi /u/Designer-Composer931,

We noticed you are a pretty new Reddit account, so we just wanted to let you know to check out the subreddit rules [here](https://www.reddit.com/r/NoStupidQuestions/wiki/rules) and maybe have a read through our [Frequently Asked Questions](https://www.reddit.com/r/NoStupidQuestions/wiki/index/faq) - they make for fascinating reading!

We're called No Stupid Questions because we believe nobody needs to be attacked for asking a question, but *that doesn't mean there are no rules!* This sub is meant for users like you to ask genuine questions. Please don't ask jokes or rants disguised as questions - that's not in the spirit of this sub. While you *can* ask almost anything here, please keep illegal and offensive questions elsewhere to give people a good experience here - and if you have a medical question, please ask your doctor, not us. 
    
Otherwise, welcome!

*I am a bot, and this action was performed automatically. Please [contact the moderators of this subreddit](/message/compose/?to=/r/NoStupidQuestions) if you have any questions or concerns.*"
256,How do animals know to look us in the eye?,"I think every tetrapod probably understands how to recognize the eyes of another tetrapod: it's a matter of life and death to know if a predator is looking at you or not.

I think predators like dogs and cats might have a more complicated system of communication because their forward-facing eyes make turning to focus on you a much clearer message.

Being aware that another creature can see as you see and remember as you remember (as opposed to simply using eyes to communicate/instinctively percieving eye contact as a threat or botched hunt) is a higher level of intellect, part of ""theory of mind"". I think scientists were surprised to find that crows have this, for example: they will hide food in front of one crow and run back to the hiding spot if they see that specific crow return, because ""he saw, he knows""."
257,Why do people thank their boss/company?,Do you want to keep your job? Lie or don’t 😭😭
258,"Is this text really ""cringe""?",You need smarter friends. You did absolutely nothing wrong.
259,What's the evolutionary purpose of preferring foods with certain textures?,There isn't. Evolution isn't some perfect process where every aspect of a living being fits in perfectly. Adaptions that were made to solve one problem end up being applicable to others.
260,How do I extract texts?,"Hi /u/Flashy-Window-5213,

We noticed you are a pretty new Reddit account, so we just wanted to let you know to check out the subreddit rules [here](https://www.reddit.com/r/NoStupidQuestions/wiki/rules) and maybe have a read through our [Frequently Asked Questions](https://www.reddit.com/r/NoStupidQuestions/wiki/index/faq) - they make for fascinating reading!

We're called No Stupid Questions because we believe nobody needs to be attacked for asking a question, but *that doesn't mean there are no rules!* This sub is meant for users like you to ask genuine questions. Please don't ask jokes or rants disguised as questions - that's not in the spirit of this sub. While you *can* ask almost anything here, please keep illegal and offensive questions elsewhere to give people a good experience here - and if you have a medical question, please ask your doctor, not us. 
    
Otherwise, welcome!

*I am a bot, and this action was performed automatically. Please [contact the moderators of this subreddit](/message/compose/?to=/r/NoStupidQuestions) if you have any questions or concerns.*"
261,How often are you suppose to get a Pap smear?,Annually.
262,"Why is it common for Redditors to say ""I don't mean to x but..""",It’s a very common practice in real life as well. It’s used to try and save face or preemptively defend themselves when they want to do or say something they know will be perceived negatively. If they truly didn’t expect someone to take offense at what they’re saying they wouldn’t have said “ I don’t mean to ___” in the first place
263,Is it possible to get ripped without the diet dedication?,"Depends on what you mean by putting on some muscle. If you just want to be “in decent shape”, you have to pay some attention to your diet, but not necessarily your full focus. If you want to be absolutely ripped, yes you have to optimise your diet, well you have optimise almost every aspect of your life around that goal. 

If by protein complementary food, you mean protein bars and shakes, the bars get really expensive, and the shakes you can make by yourself could be relatively cheap, but ultimately it’s best to get your protein from less processed sources like chicken breast, if you can. 

If you are skinny, you do have to eat enough to bulk up. But if you are just looking to be reasonably toned with a bit of muscle, it shouldn’t be necessary to strictly count your calories and count your every macronutrient, and you don’t need to go to the extremes of eating 3000 calories with 150g of protein or anything huge like that. 

If you are a beginner to weightlifting, you can build some level of muscle relatively easy and quickly before you hit a plateau. Follow a simple lifting routine like the stronglifts 5x5 plan, do it 3x a week, eat a bit more than your usual and try to focus on protein sources. You can use a scale to monitor if you are slowly gaining weight. If you want to progress beyond that and get even more muscular, then you can consider from then on. But the best thing to do is to get started and get yourself used to a routine, after that you can decide whether to become even more dedicated and make it even more complex. 

People in prison still get muscular, even for those who can’t count calories and macros and can’t eat whatever they want. Manual laborers in developing nations are lean-muscular. One of my friends works out and is quite muscular, and what he eats is just whatever is food leftover at the bar at the end of shift (he works as a bartender). Sure, I think he has lucky genetics and genetics help, but you can make it work."
264,Is it normal to use your mom's facebook account to check out her friends,No…
265,I want to turn off this thing that shows fps and gpu usage but idk what program is doing this. What's it called?,Looks like its the overlay from Riva Tuner Statistics Server which may be installed by itself or packaged along with MSI Afterburner.
266,Are judges just being petty?,"Ever heard of [Ariel Castro?](https://en.wikipedia.org/wiki/Ariel_Castro_kidnappings) He was sentenced to 1,000 years in prison. That's ridiculous, right? Nobody could possibly live that long! But it turns out that even a sentence like that is actually pretty reasonable.

Those super long sentences are actually the result of *multiple* crimes being added together. Castro's thousand-year sentence is actually the result of **937** counts of kidnapping, rape and aggravated murder. When you add up the punishment for all those crimes, you may instead wonder why he wasn't given a *longer* sentence!

There's a good reason why courts do it this way - three, actually. First, it's part of giving justice to victims. The victim of the crime and their families deserve to know that the offender is getting punished for what they did to *them*, whether or not they are already getting punished for a different crime they committed. Secondly, it prevents the criminal from getting released if they are able to overturn *one* of their sentences on appeal. And thirdly, it can help keep that person in prison! In many countries, a life sentence isn't actually for life - it could mean a set number of years (25 or 15), or it could come with the possibility of parole after some time has passed. In other countries, someone must serve a percentage of their full sentence before they are eligible for parole (one third of their sentence in Canada, for example) or before they are moved from prison to house arrest (two-thirds of their sentence in Minnesota, for example). If someone has a sentence of 200 years, then even one-third of that is going to be long enough that it won't matter much to survivors."
267,is it true that you can’t love anyone if you don’t love yourself? and why?,What is more true is you can't accept or truly experience anyone else's love for you if you don't love yourself
268,Are pets slaves?,I think I am a slave to my pet
269,How has my eyesight improved?,"Yep, happened to my dad although he was a couple decades older at the time."
270,How do fishermen who don't catch and release very large fish manage to eat the entire thing by themselves?,"Hi /u/InfluenceDry7454,

We noticed you are a pretty new Reddit account, so we just wanted to let you know to check out the subreddit rules [here](https://www.reddit.com/r/NoStupidQuestions/wiki/rules) and maybe have a read through our [Frequently Asked Questions](https://www.reddit.com/r/NoStupidQuestions/wiki/index/faq) - they make for fascinating reading!

We're called No Stupid Questions because we believe nobody needs to be attacked for asking a question, but *that doesn't mean there are no rules!* This sub is meant for users like you to ask genuine questions. Please don't ask jokes or rants disguised as questions - that's not in the spirit of this sub. While you *can* ask almost anything here, please keep illegal and offensive questions elsewhere to give people a good experience here - and if you have a medical question, please ask your doctor, not us. 
    
Otherwise, welcome!

*I am a bot, and this action was performed automatically. Please [contact the moderators of this subreddit](/message/compose/?to=/r/NoStupidQuestions) if you have any questions or concerns.*"
271,Why don’t houses have urinals?,"Hi /u/suramgea,

We noticed you are a pretty new Reddit account, so we just wanted to let you know to check out the subreddit rules [here](https://www.reddit.com/r/NoStupidQuestions/wiki/rules) and maybe have a read through our [Frequently Asked Questions](https://www.reddit.com/r/NoStupidQuestions/wiki/index/faq) - they make for fascinating reading!

We're called No Stupid Questions because we believe nobody needs to be attacked for asking a question, but *that doesn't mean there are no rules!* This sub is meant for users like you to ask genuine questions. Please don't ask jokes or rants disguised as questions - that's not in the spirit of this sub. While you *can* ask almost anything here, please keep illegal and offensive questions elsewhere to give people a good experience here - and if you have a medical question, please ask your doctor, not us. 
    
Otherwise, welcome!

*I am a bot, and this action was performed automatically. Please [contact the moderators of this subreddit](/message/compose/?to=/r/NoStupidQuestions) if you have any questions or concerns.*"
272,How often do you touch yourself?,"Well, some part of my body is usually in contact with another part of my body, so pretty much 24/7.

If you mean ""dirty"" touching, then... also 24/7 :)"
273,Tyramine content in decaf vs regular coffee?,"Ask your oncologist, it's what they're for"
274,Do eggs with double yolk also have double whites?,Once had one egg three yolks. It was mainly yolk.
275,Why do humans find cats cute but not bugs?,"I do find bugs cute, personally."
276,Is a want to experience prostrate orgasms make me gay?,"No, you should choose your preferred position, and if you like having an orgasm while lying stretched out with your face towards the floor that's completely fine."
277,Why is it wrong for someone with a girlfriend/boyfriend to go out to drink with friends?,"The actual red flag is people who don’t want their partners going out with friends. You either trust them to not cheat on you, or you should just break up. This was more common in high school with guys who were insecure and/or jealous and manipulative. But it’s even more of a red flag to not have grown out of this thought process by adulthood."
278,"Is it The Jones', The Joneses, or The Jones's","If their name is Jones, then Jones' is the singular possessive. That would be saying ""this is the place owned by a Jones"". The plural possessive would be Joneses'. If they wanted to say ""There are a lot of people named Jones here"", then that would be the plural, which would be Joneses. 

Given that they started with ""The"", I suspect they wanted the possessive, and probably the plural, so it should probably be Joneses'."
279,Why is there no full screen smartphone/Iphone?,"You want some bezel.  A totally edgeless screen would be even more vulnerable to damage than phones already are. It also gives you somewhere to hold the phone without activating the touch screen.

In terms of cameras behind the screen, these [already exist](https://www.smartprix.com/bytes/under-display-camera-phones/)."
280,Is QAnon still a thing?,"One of its more notable promoters, Jim Caviezel, stars on the film Sound of Freedom, which is alleged to have QAnon ties. But it has quieted down significantly as many followers have grown disillusioned after many failed predictions, and other promoters have either backtracked or kept silent on their support due to legal troubles."
281,Can my school access my history through my email?,No. Email accounts don’t have access to search history.
282,question abt STD's and pregnancy,IVF.
283,What are your thoughts on the Marc Jacobs tote bag?,"It's over priced designer tat that isn't good for anything except impressing people who aren't worth impressing.

On top of that, I think it's pretty tacky looking."
284,Am I the idiot for feeling frustration/anger for my partner traveling to another country for a few days?,"You're not an idiot, but something you'll understand more with time and experience is that it's good and healthy for partners in a relationship to take time for themselves. You are still individual people and you don't need to (and shouldn't) do every single thing together. It doesn't sound like you're worried about her cheating or anything like that while she's away -- just that you're feeling left out. It's also not like she's going for months; she'll only be gone for a few days. Your partner is communicating clearly with you and it's up to you to decide if what she's offering is something you can live with. 

If you want to be included on one of these trips in the future, you could suggest that. You don't have to come on every single one, but maybe it would be nice to do once or twice. But for now, it's important to recognize that your partner hasn't done anything wrong and is allowed to have aspects of her life that don't involve you."
285,Where does the light in the sun comes from?,When two atoms are fused together it's so energetic that a photon is created.
286,How did the idea get started that a tip you give is based on the total price of the bill?,As opposed to what? Keeping track of how many times they've had to walk back and forth to every single table the entire evening?
287,"Whenever I hear Republicans in smaller counties say they want to secede away from big cities, the democrats always counter that if they did, they would have no money bc the cities have all/most of the money. Is this true and how?","Big cities have large populations which means more employees, more businesses, more people buying things, more events and entertainment. There are more things to do in general and more opportunities, so people with money are often more attracted to those areas."
288,How is Steven Seagal’s movie career a thing?,His movies were entertaining enough that people would go see them. Note that entertaining doesn't mean they're good movies.
289,I have personal-training homework and the person I'm training isn't following my schedule. How can I get them to follow it?,Are you not able to talk about your difficulties in getting them to follow it? Seems like that would be a common problem in personal training and worth discussing on its own in the paper?
290,Android boxes,Android TV box?  Be careful - those things are apparently frequently infested with malware.
291,Anyone else ever forget whether a memory actually happened or if it was just a dream?,"Yes, all the time"
292,Is it normal to keep waking up horny?,My sex drive has peaks and troughs to be honest. I’ll go for months or not thinking about it then have a few weeks of just having to choke the gecko 3/4 times a day until dust is coming out
293,Currently getting inquiries for table service at a high-end nightclub. They always want to know what the occasion is? Will it make a difference what my answer will be?,"Yes, weddings will cost more."
294,Question about Affirm loan payment option.,"Affirm may offer a lower interest rate than a credit card, assuming you make all payments on time.

Depending on card, carrying any balance in a credit card month to month will subject any carried balance, and possibly new charges as well, to interest charges at an APR of 20% or more.

Even for my main credit card, it's ""plan it"" BNPL feature still charges over 1% fees per month."
295,Why do we get so attached to one person?,"Love is like a physical drug, when you are a team with someone you love you feel so much more confident and powerful, and having been loved leaves a mark just like parents love does"
296,How do I (17M) tell my therapist that one of my only stress relief methods is bad?,"Therapists are there to handle your thoughts my guy, honesty is key if you want to improve. They won’t judge, most have heard much worse."
297,Is the fact that we can see things in space millions of lightyears away proof that things have been around for millions of years?,That's the gist of it. Yeah.
