,titles,answers
625,What can I do to stay awake and not fall asleep?,Have you tried chewing gum? Chewing gum simulates eating and why would your body just start sleeping when it's eating. Yes I do know that it can be people who sleep while they're eating but you get what I'm saying.
626,Am I better off staying with my credit union or should I switch to Capital One Banking?,"Honestly, if you like the bank you’re with right now. Just stay with them it’s ok to open up a new one just for the reward. My husband and I did the same thing when we were in a mess after having our first baby we never used the account. It closed after a while since we didn’t use it, I worked retail as well so I didn’t mind."
627,How did France exactly manage to amass 1 million soldiers during the Napoleonic War in a time of anarchy and rebellion within the country?,"*Most of the men in Napoleon’s Grand Armée were conscripts drawn from the poorer classes. Every able-bodied man of age in France was expected to willingly join the ranks to defend the Republic – or risk losing citizenship. In theory soldiers were eligible for discharge after five years, but after 1804, most discharges were only for medical reasons. Most new soldiers received little training, and had to learn their trade on the battlefield.*

[https://www.pbs.org/empires/napoleon/n\_war/soldier/page\_1.html#:\~:text=PBS%20%2D%20Napoleon%3A%20Napoleon%20at%20War,Republic%20–%20or%20risk%20losing%20citizenship](https://www.pbs.org/empires/napoleon/n_war/soldier/page_1.html#:~:text=PBS%20%2D%20Napoleon%3A%20Napoleon%20at%20War,Republic%20–%20or%20risk%20losing%20citizenship)."
628,How does a girl check out a guy..what does she look at?,"Same things as guys, whatever they personally like"
629,How do y’all work full time jobs and not eventually lose your shit?,"Rule 1: Never let them see you sweat.

Rule 2: Chose where you focus your energy. 

Yes.  I lose my shit every day at work and I have for decades but I never let them see it.   I accept there are things in life I can't change.  I chose to focus my energy on the things I can control.  Throwing my energy at things I can't change is like screaming at the wind."
630,"After around a week of no fap, I get wet dreams so I have to do it every week, is this normal?","That can be a side-effect of not having an orgasm regularly, yes."
631,Is there any actual mercury on Mercury?,"Not according to Wikipedia's section on the composition of Mercury, no."
632,What is this called?,"Sounds like you’re just really empathetic. This happens to me too, especially if the person is someone I love. Hearing my friends talk about things like promotions at work or seeing their partners hug/kiss them makes me feel giddy too. Second-hand joy, ha! You’re just feeling what theyre feeling—you’re empathizing. It’s not really controllable. This can happen with people you know or with total strangers!"
633,"What ""jelly"" does Destiny's Child say I'm not ready for?","Her butt.  About which it has been said, ""it must be jelly cuz jam don't shake like that""."
634,"Why are they called ""in-laws""","It's not an implication that people make with the married couple. Jane's brothers is now John's brother in-law, but nobody considered John and Jane to be siblings in law.

It is one of those expressions that yeah, maybe it does not make sense when you apply to this particular situation in this particular way, but everyone generally gets it. Think of it as an idiom if you wish."
635,How do you get really good at life and presentation without preparation? - 30F who is often put on the spot at her job.,"It is just a question of mastery. Rather than cramming for that one particular meeting with a specified group of people and talking about a defined topic, you will reach a point where you know your job well enough to be able to handle a real time challenge. It's just a matter of really knowing your stuff. You'll get there, just pay very close attention to business developments and maybe do some extra reading at home."
636,Is the delicate setting on the dryer supposed to fully dry clothes?,"I'm confused 
>When I wash things on ""delicate"" they come out damp.

They should, you should have a delicate setting on the ***DRYER***. depending on what they are you might want to air dry them."
637,Why is everyone able to afford iPhones even tho they are crazy expensive?,Generally they pay it off as part of their phone plan instead of buying one up front
638,What should I do?,"> For context, she is 10 years old, and is known to be a little promiscuous for her age. 

Stopping right here with this nonsense."
639,Is there a nutritional difference between a slice of bread and a slice of toast?,Slim to none.
640,How did AIDS evolve from being a disease in chimpanzees to being amongst homosexual men?,"Its thought it may have spread through butchering bush meat.

Also, most people with HIV aren't gay men"
641,I am a white woman who lives in a white majority region. How do I contribute meaningful support to Women of Color (specifically Black Women) when moving to a more diverse area is not an option (my entire family lives here),"Rise your children with the same values, you don't need something that people can point to, if you really want to help"
642,"Can people with a photographic memory watch reruns in their head, rather than having to watch them?",There's no such thing.
643,"When people say ""I make $XXX"" or ""Would I survive if I only make $XXX living in NYC?"", do they generally mean pre-tax or after tax?",Pre-tax
644,Vick's vaporub under my nose to eliminate/dull sense of smell?,"Vaporub is basically menthol mixed in Vaseline. There's nothing dangerous about it, so it should be fine. You do want to avoid getting it in your nose but more because it'll sting like a bitch than anything else."
645,“Artists” that just throw paint to something is considered art?,"Beats the hell outta me. But, I see it all the time and it’s infuriating. Like I spend a lot of time trying to make my paintings look realistic"
646,Lost cookies,"Were they kinda a mistake of ginger bread flavor and spicy but not overly so? 

Were they crunchy or chewy?

When were you a child?"
647,What aren't all vitamins chewable?,"all Vitamin Supplements are, but they don't taste good if you do."
648,Am I insane or does it sound like a ton of songs on the radio are sped up/pitched up slightly?,"Not insane. Not every station does this, but it’s been a practice some stations have used for decades. A station might play 10-12 songs in an hour. If you can speed it up enough to shave just a little more than a second off a three-minute song, you can sell an additional 15-second ad spot. If you speed them up even more, it generates even more sellable time."
649,How many people broke up because of the barbie movie?,"Could you link the story/post? I have no clue, but i also want to know, and why?"
650,Can you do 100 push-ups in a row?,After 10 push-ups i can keep pushing up but I won’t get off the floor
651,What’s the name of this instrument?,It's a [Jew's Harp.](https://en.wikipedia.org/wiki/Jew%27s_harp)
652,Why can't I fall asleep without the sound of my fan ?,"It produces a white noise like sound, which is said to relax people. 

And have you always slept with a fan on? It could have become a part of your sleep routine, which means it would be hard to sleep without it"
653,How would I go about having my fiancé and friends do a comedy roast on me?,My advice: DON'T DO IT!
654,Migration Choices: African Refugees' Paths to Europe,because europe is even wealthier
655,"What do you call when someone becomes obsessed or swoons over someone who rescues them, or saves them from a situation?",Transference.
656,Why don't shops get sued for their own rip off products,"Because blatant is subjective.

Nutella doesn't own the whole concept of chocolate spread. So the question becomes how close is too close?

Is 7up a rip off of Sprite?

Is Pepsi a rip off of coca cola?

Because Hershey's has a chocolate bar, is nobody else allowed to make chocolate bars?"
657,What is with the sudden love for pickleball?,"Ease of play, the low cost of entry and sociability. It is more relaxed, friendly, cheaper to get involved in, and easier to master."
658,Why can hangman be played by children?,Wait until you hear about kids pretending to be cowboys shooting at each other.
659,"Why is it people can go their whole lives doing good towards other people, being completely selfless and helping thousands of not millions of others along their journey, do one wrong thing, and suddenly everyone thinks they're ""showing their true colors""?","[McGregor](https://jokes.one/joke/mcgregor-the-bridgebuilder), is that you?"
660,"Blowers have stopped working in my car, am about to change fuses. Other than engine being off, is there anything else ‘safety-wise’ I need to know beforehand?","If you want to feel extra safe you can make sure the keys are fully out of the ignition.  I've changed fuses with and without the electricity running through the vehicle and there's not enough power for anything to arc or bother you, especially with a dead one"
661,Did my Montgomery glands react because I was around a baby?,Are you talking about [mammary glands](https://en.wikipedia.org/wiki/Mammary_gland)? I do not think they had a reaction & the “glands” would not be “noticeable.”
662,Why do women cry when their so/bf proposes?,spending the rest of their life with them is a pretty big deal
663,"Book recommendation, with the plot of a person who is always blamed at for everything, and how his/her mentality is affected by those traumas","Find the raised by narcissists sub, I bet people there will know. I can’t link."
664,Is there anything your child could do to make you disown them?,"Becoming some kind of terrorist, nazi, klansman, etc."
665,How long till the k-dashians pass over the realm of real to plastic?,I think that train has already left the station.
666,"When lifting, is it important to have a fast concentric and slow eccentric?","Generally, yes. The concentric portion should be a little faster and the eccentric slower. There are people who will describe more precise parameters—e.g. 2 sec concentric, 4 sec eccentric—but that is not really important. 

IMO, having control of the weight throughout the ROM is the most important thing, rather than any strict timing. 

But, yes, you want to keep the weight under control during the eccentric (lowering) part of the movement, not just let it “drop”."
667,Why are Americans so obsessed with politics?,"> Never in my life have I ever seen another country so unbelievably obsessed with politics as American citizens are. Literally fights, verbal and physical abuse, 

Then I say you have not really been watching others."
668,Can you pay with PayPal to post on craigslist? how safe is craigslist when it comes to transactions to post on the website?,"Craigslist is the bottom of the barrel for online shopping. I don't know if it's improved recently, but last time I used it I just met some guy in a parking lot."
669,Earth equator vs diameter,"The equator would be a circumference, so it would be more than 3 times the diameter."
670,"If an Embassy were to start shooting people who fell into it's jurisdiction, could the host country do anything about it?","You might be interested in the [Murder of Yvonne Fletcher](https://en.wikipedia.org/wiki/Murder_of_Yvonne_Fletcher).

> The murder of Yvonne Fletcher, a Metropolitan Police officer, occurred on 17 April 1984, when she was fatally wounded by a shot fired from the Libyan embassy on St James's Square, London, by an unknown gunman. Fletcher had been deployed to monitor a demonstration against the Libyan leader Muammar Gaddafi, and died shortly afterwards. Her death resulted in an eleven-day siege of the embassy, at the end of which those inside were expelled from the country and the United Kingdom severed diplomatic relations with Libya."
671,What's the most addictive part about a dating app?,"I think it’s when you’ve sent the first message and they actually respond, then the couple of responses after that. Even though I’m reasonably confident that always made me fairly giddy"
672,How do I make my parents stop resenting me for not having a boyfriend?,"Tell them that if they continue to demean you when you're spending time with them, then you will stop spending time with them, and be ready to carry that out."
673,How to fix the comment not showing on reddit app?,"Post on r/redditmobile and see if any one else is seeing this issue.

(I haven’t seen this, but I’m not running the same app)"
674,How do you deal with being a failure who gets picked on? Do you just accept your station in life as a punching bag?,">gets picked on

By who?

Why?

How are you a ‘failure’?"
675,Am I the only one that doesn’t care to spend time with people?,"I too am an introvert… so no, you aren’t"
676,How do I get my instagram account back?,That doesn’t sound right. Who’s “they”? Sounds like you’re being scammed.
677,How long until you think a guest is overstaying?,"Unless it is family, I think that 4 nights is about the limit.  And even with some family."
678,Overcharged for a grocery item. What should I do?,"I work at a grocery store and I’d maybe even politely explain this whole thing to a manager, that’s deeply uncool."
679,Age of 36 what should we should be eaten?,"I'd rather have died younger and lived a little than lived a little longer without living.

Have a beer and a piece of cake, Jesus."
680,'mildew' smell on clothes,"You're probably good go go bro.

You may want to get some scent booster to be extra sure (the salt will help kill shit too. Scent booster is just scented rocksalt)"
681,Do community boycott anymore?,Can't boycott anything if we're too busy fighting each other.
682,"Rank these Alexander’s from worst to best: Alexander Hamilton, Alexander Mahone, Alexander Mattison",Graham Bell is the GOAT 🐐
683,at what age did you have your first girlfriend or boyfriend?,"23. Start of this year. Some people have had their first partner many years older than me. Don't worry, there's nothing wrong with not having had a first kiss or partner."
684,"Why is the main character in Dirty Dancing whose name is Frances, called ""Baby""?",It’s a diminutive term of endearment and indicates her innocent nature. Baby is a common term of endearment in English and doesn’t mean a literal baby.
685,How can I make 20 dollars quickly?,"That’s a very reasonable amount of money to borrow from a friend or family member, especially if you offer to give them $25 or $30 back when you get your pay check (and stick to that)"
686,"What is ""Vril Maxxing""?",It's the process (or condition) of vrilizing the vaxxing by using an artificial or a natural virlizore (virlizour in UK) in a certified virlizing clinic that meets the state's requirements of the vaxxing virlization process.
687,Can you name a duck who's not a jerk?,Daisy
688,Does your body know what time it is when you sleep,"Yep, and as you get older your body perfects this cool little trick! I still set my alarm during the week but I never make it to hear that annoying blast. It’s a wonderful thing."
689,"When a man and a woman argue and the man shouts at the woman often people tell him to stop, or ""respect women"" because men are stronger etc. Why?","They're strangers, so they're generalizing that his strength makes him intimidating and the intimidation can be used to manipulate her."
690,Are men or women more dramatic?,"100P men. But they rebranded anger, annoyance and frustration as “non-emotions”, so they don’t see how dramatic they are."
691,Gifting wife an engagement ring,"Not at all—it’s not an engagement ring now, it’s an anniversary ring.  And it’s very sweet and sentimental that it completes the set from your wedding day.  Just make sure it’s not sized to fit her left ring finger if that’s where she wears her wedding rings, since she won’t be able to wear both"
692,Does she feel anger towards me??,She's dumb and crazy .. AVOID HER .. she can accuse you of something and ruin your life!
693,"After drinking, I slept for the same time without waking up, yet I'm so much more tired. How?",Alcohol does that. It takes a lot of energy to recover from a mild poisoning.
694,Could tik tok be a mass desensitization tool?,"Can you elaborate on what a ""desensitization tool"" is?"
695,Should I have given him a chance?,"No, don't let anyone pressure you into a relationship if you think it wouldn't work."
696,How can I stop envying my boyfriend?,"Hi /u/Perfect_Statement_36,

We noticed you are a pretty new Reddit account, so we just wanted to let you know to check out the subreddit rules [here](https://www.reddit.com/r/NoStupidQuestions/wiki/rules) and maybe have a read through our [Frequently Asked Questions](https://www.reddit.com/r/NoStupidQuestions/wiki/index/faq) - they make for fascinating reading!

We're called No Stupid Questions because we believe nobody needs to be attacked for asking a question, but *that doesn't mean there are no rules!* This sub is meant for users like you to ask genuine questions. Please don't ask jokes or rants disguised as questions - that's not in the spirit of this sub. While you *can* ask almost anything here, please keep illegal and offensive questions elsewhere to give people a good experience here - and if you have a medical question, please ask your doctor, not us. 
    
Otherwise, welcome!

*I am a bot, and this action was performed automatically. Please [contact the moderators of this subreddit](/message/compose/?to=/r/NoStupidQuestions) if you have any questions or concerns.*"
697,Car Insurance More Expensive? UK,I think so. Try asking at r/askUK
698,Would complimenting a bartender's tattoo be seen as flirting?,We need more details. Impossible to say rn.
699,Would I be breaking any laws if I used Whisper AI to record and thus transcribe phone calls?,"Depends which state. If you live in a state which has two party consent laws, it would be illegal. If not, then it would not."
700,Outside of USA is there places in other countries that have American pockets?,"In many places in Asia and in Australia, American culture is already pretty ubiquitous, so it's less than they assimilate into our cultures and more we have assimilated theirs.

What would a Little America look like anyhow? Pizza and burger joints? Ribs & grill? We got that all over here already.

edit: one more thing, Americans don't immigrant, they expat. It's a different mindset that results less in establishing ethnic enclaves."
701,U.S.A. Drone Flight Data,"[FlightAware](https://www.flightaware.com) is a good source, but I think you need to pay for historical data.

[They have instructions on how to build your own ADS-B receiver](https://www.flightaware.com/adsb/piaware/build/) if you want to setup your own flight monitoring near you."
702,When you live with someone does your bathroom habits sync up?,"I don't know, but my wife and I lived for quite a while in places with just a single bathroom, and it really was a problem.  So many years ago we finally moved into a house with 2.  And it was so much better."
703,Why do men think that pants that end two inches above the ankles is a good look?,what is good is subjective
704,Is it too much to ask my landlord this?,"Absolutely say something! My partner and I started renting a home that wasn’t well cared for by the previous tenants & the property managers never checked it over before giving us the keys. Beyond many issues we’re still sorting out, we put maintenance requests in about the fridge (wasn’t keeping cold, leaked coolant) and dishwasher (heating element rusted, filter dirty beyond salvaging). We didn’t ask for replacements, but when the maintenance/appliance folks saw the photos, they told our management that both appliances needed to be replaced. So, now we have new appliances! As renters, we pay $$$ to landlords so they can handle these situations for us. Best of luck to you both!"
705,How do you forgive yourself for messy mistakes in the past?,"First, were these actually ""mistakes""?  Or were they conscious bad acts/negligence/carelessness?

Consider dealing with what you did for what it is, rather than calling it an ooopsie as if you'd stepped on the dog's tail in the dark.

Then, learn this mantra:  *That was me THEN. THIS is me NOW.* And remind yourself that you've learned your lesson and never want to cringe about anything else anymore, so you're going to avoid making decisions as you did in the past."
706,What exactly is an eccentric character?,"""Eccentric"" Basically just means ""weird, but in a wealthy/charming way""."
707,Can active duty soldiers from different armies get married?,"As far as I know, there shouldn't be any policies preventing them from getting married."
708,"why do the early 1900s feel ""retro"" but the late 1800s (only a decade apart) feel like the middle ages?",They didn't have electricity. That's the main thing that differs from 18 to 1900.
709,How would an object spinning at light speed work?,">the point 10m away must be moving at a much higher speed

For speeds that we encounter on a day-to-day basis, yes. For speeds that approach the speed of light, [velocity addition](https://en.wikipedia.org/wiki/Velocity-addition_formula) gets more complicated than 1+1=2. Time dilation makes the whole thing *very* unintuitive.

>Would I be prevented from spinning this quickly

In practice, attempting to spin that quickly would destroy you, or the stick, or both. I'll share a [relevant post from XKCD](https://what-if.xkcd.com/1/) as an illustration of how ridiculous these scenarios can get."
710,If a 18 year old makes alcohol at home would they get in trouble even if the people drinking it are 21 or older,ABC will kick down your door and burn your house to the ground. You are safer cooking meth
711,"Why have coffee shops become positively bare, uncomfortable, and often dirty spaces recently?",So people will stop camping out there?
712,How do you avoid that awkward half-cheek-kiss-half-hug when you’re not sure if your family is going for a hug or a cheek kiss or both?,let them come to you then and see what they do
713,Should your savings go up in value?,It depends on what you are saving.
714,How do I find shows that both me and my dad will like?,"It’s your dad, surely there’s something on his list that is moderately interesting to you? Watch that. 

Some of the cooking competitions are kinda fun. I’ll enjoy Chopped or Beat Bobby Flay."
715,Using Peppermint Castile Soap To Repel Bugs,"You can do this because it won’t hurt you, but I wouldn’t recommend using soap as it’ll leave a film on everything. 

Using peppermint-oil solution would be better, although that, too, might leave marks. You need just a few drops in a spray bottle of distilled water — shake every time you use it, and test on a hidden spot if you’re going to spray it on fabric. 

You can also probably use peppermint extract/water, but the extract isn’t as strong as the oil."
716,"I'm curious- what do orgasms feel like for other women? Ladies, can you describe your different types of orgasms?",Damnn. It's just the sexual sighing with squirting for us men. 🥹
717,How do I deal with someone triggered by something I said or did?,"If this happens a lot, it sounds like you're the one who doesn't know how to be professional."
718,Propane: Is it common for people to use PVC pipe for the supply line from the propane tank to the house?,Never.
719,Is the sun’s path taken into consideration when building an open-top stadium?,"It is. And they purposely put the visiting team in on the worse side. It’s unfair. It’s on purpose.

Tbh idk if your exact example is even unfair or consistently unfair depending on the time of day. But that kind of thing does happen in general. In cold weather outdoor stadiums away teams would often be in shade that was way colder than the home teams side."
720,Can someone help me come up with a cool username using my name? Its Daryle,"Hi /u/NoSatisfaction6751,

We noticed you are a pretty new Reddit account, so we just wanted to let you know to check out the subreddit rules [here](https://www.reddit.com/r/NoStupidQuestions/wiki/rules) and maybe have a read through our [Frequently Asked Questions](https://www.reddit.com/r/NoStupidQuestions/wiki/index/faq) - they make for fascinating reading!

We're called No Stupid Questions because we believe nobody needs to be attacked for asking a question, but *that doesn't mean there are no rules!* This sub is meant for users like you to ask genuine questions. Please don't ask jokes or rants disguised as questions - that's not in the spirit of this sub. While you *can* ask almost anything here, please keep illegal and offensive questions elsewhere to give people a good experience here - and if you have a medical question, please ask your doctor, not us. 
    
Otherwise, welcome!

*I am a bot, and this action was performed automatically. Please [contact the moderators of this subreddit](/message/compose/?to=/r/NoStupidQuestions) if you have any questions or concerns.*"
721,"Why do I ALWAYS get hungry, then fall asleep ASAP.","If I’m understanding this correctly, you smoke, then eat a whole bunch, and then fall asleep. 

This is completely normal. I’m assuming you’re talking about smoking weed. In that case, both intense cravings/hunger and tiredness are symptoms of a being high. Smoking often makes people really hungry, this is called the munchies. Being high can also make you really tired/drowsy."
